Question,CoT,Response
What is NewJeans?,"To answer this, we first identify whether ""NewJeans"" refers to a general term or a specific entity. In contemporary pop culture, ""NewJeans"" is a well-known K-pop girl group formed by ADOR, a subsidiary of HYBE Corporation. Analyzing their emergence, branding, and musical style clarifies the term.","NewJeans is a South Korean girl group formed by ADOR under HYBE Corporation, known for their minimalist Y2K-inspired aesthetic and fresh, genre-blending music."
How does NewJeans’ concept differ from traditional K-pop group concepts?,"To understand this, we need to compare the stylistic and branding elements typical in K-pop—like elaborate lore, flashy visuals, and heavy production—with NewJeans’ stripped-down, retro-inspired and casual style. Their focus on authenticity and Y2K fashion stands out.","NewJeans diverges from traditional K-pop with their minimalist visuals, nostalgic Y2K fashion, and a focus on naturalism and relatability rather than elaborate concepts and heavy production."
Why has NewJeans gained such rapid popularity internationally?,"Popularity can be attributed to various factors like viral marketing, visual identity, and musical innovation. Analyzing their strategic debut, catchy songs, and effective use of platforms like TikTok explains their global traction.","NewJeans gained international popularity due to their viral social media presence, catchy genre-blending music, and refreshing aesthetic that appeals to global youth culture."
In what ways do visual aesthetics contribute to NewJeans' brand identity?,"Visual aesthetics in K-pop play a crucial role in storytelling and audience engagement. By examining NewJeans’ retro visuals, Y2K styling, and casual presentation, we can see how these elements reinforce their image as youthful and relatable.","NewJeans' use of retro visuals, Y2K fashion, and minimal styling enhances their brand identity as fresh, relatable, and nostalgic, distinguishing them from more theatrical K-pop acts."
How does the formation of NewJeans reflect shifts in the K-pop industry?,Understanding this requires examining industry trends toward more organic and relatable group images. HYBE's creation of ADOR and the group's concept suggests a strategic response to evolving global tastes in music and branding.,"NewJeans’ formation reflects a shift in K-pop toward authenticity, minimalism, and global youth appeal, indicating a broader industry move away from high-concept, overproduced acts."
What role does language play in NewJeans’ global outreach?,"K-pop groups often include English in lyrics and social content to connect with non-Korean audiences. Evaluating NewJeans’ song lyrics, member interactions, and online content reveals how multilingual communication expands their reach.","Language plays a key role in NewJeans’ global outreach, with strategic use of English in music and social content helping bridge cultural gaps and engage international fans."
Compare the debut strategy of NewJeans with that of other 4th-gen K-pop groups.,"Debut strategies differ in marketing, music style, and rollout. NewJeans’ surprise release and minimal pre-debut hype contrast with teaser-heavy launches like Aespa or Le Sserafim. This contrast reveals innovative branding choices.","Unlike many 4th-gen groups with elaborate teasers, NewJeans debuted with minimal promotion and a surprise release, creating buzz through curiosity and viral music instead of traditional build-up."
How does NewJeans leverage nostalgia to appeal to Gen Z audiences?,"Though Gen Z did not experience the early 2000s firsthand, Y2K nostalgia is trending. NewJeans’ music, styling, and video formats evoke this era in a modern context, tapping into a reimagined nostalgia.","NewJeans taps into Y2K nostalgia with fashion, visuals, and sound, repackaging early 2000s trends in a way that feels fresh and appealing to Gen Z’s retro sensibilities."
What are the implications of NewJeans’ commercial partnerships for their artistic image?,"Brand deals can amplify reach but may clash with a group's image if not aligned. NewJeans’ partnerships with luxury and youth-oriented brands align with their fashion-forward, youthful identity, enhancing rather than diluting their image.","NewJeans’ commercial partnerships with brands like Levi’s and Apple reinforce their trendy, youthful image, showing synergy between their artistic identity and marketing choices."
How does NewJeans balance artistic expression and commercial appeal?,"This involves analyzing their music, visuals, and brand choices to see how they maintain credibility while remaining accessible. Their authenticity and creative direction resonate with fans without seeming overly manufactured.","NewJeans balances artistic expression and commercial appeal by maintaining a consistent, authentic aesthetic and sound that feels both creatively genuine and marketable."
